{
  "$schema": "../project.schema.json",
  "schemaVersion": "0",
  "name": "機器の設定＆モニタリング",
  "description": "全プロトタイプ共通の題材アプリ（#1）",
  "entry": "dashboard",
  "dataModel": {
    "source": "type DeviceStatus = \"online\" | \"offline\" | \"warning\";\n\ninterface Device {\n  id: string;\n  name: string;\n  model: string;\n  status: DeviceStatus;\n  ipAddress: string;\n  firmware: string;\n}\n\ninterface DeviceSettings {\n  deviceId: string;\n  network: { dhcp: boolean; ip: string; subnet: string; gateway: string };\n  thresholds: { temperatureMax: number; cpuMax: number };\n  pollingIntervalSec: number;\n}\n\ninterface Metric {\n  deviceId: string;\n  timestamp: string;\n  temperature: number;\n  cpu: number;\n  trafficMbps: number;\n}\n\ninterface Alarm {\n  id: string;\n  deviceId: string;\n  level: \"info\" | \"warn\" | \"error\";\n  message: string;\n  occurredAt: string;\n  acknowledged: boolean;\n}\n"
  },
  "state": {
    "draftSettings": {
      "type": "DeviceSettings | null",
      "initial": null
    }
  },
  "screens": [
    {
      "id": "dashboard",
      "name": "ダッシュボード",
      "path": "/",
      "root": {
        "id": "page",
        "type": "Box",
        "style": {
          "display": "flex",
          "flexDirection": "column",
          "gap": 24,
          "padding": 24
        },
        "children": [
          {
            "id": "header",
            "type": "Box",
            "style": {
              "alignItems": "center",
              "display": "flex",
              "justifyContent": "space-between"
            },
            "children": [
              {
                "id": "title",
                "type": "Text",
                "props": {
                  "text": "ダッシュボード",
                  "variant": "title"
                }
              },
              {
                "id": "toDevices",
                "type": "Button",
                "props": {
                  "label": "機器一覧へ",
                  "variant": "secondary"
                },
                "events": {
                  "click": [
                    {
                      "type": "navigate",
                      "to": "devices"
                    }
                  ]
                }
              }
            ]
          },
          {
            "id": "statusSection",
            "type": "Box",
            "style": {
              "display": "flex",
              "flexDirection": "column",
              "gap": 8
            },
            "children": [
              {
                "id": "statusTitle",
                "type": "Text",
                "props": {
                  "text": "機器ステータス",
                  "variant": "caption"
                }
              },
              {
                "id": "statusList",
                "type": "Box",
                "style": {
                  "display": "flex",
                  "flexWrap": "wrap",
                  "gap": 12
                },
                "children": [
                  {
                    "id": "deviceCard",
                    "type": "Box",
                    "style": {
                      "border": "1px solid #ddd",
                      "borderRadius": 8,
                      "cursor": "pointer",
                      "display": "flex",
                      "flexDirection": "column",
                      "gap": 4,
                      "padding": 12,
                      "width": 200
                    },
                    "repeat": {
                      "each": "{{ data.devices }}",
                      "as": "device",
                      "key": "{{ device.id }}"
                    },
                    "events": {
                      "click": [
                        {
                          "type": "navigate",
                          "to": "deviceSettings",
                          "params": {
                            "deviceId": "{{ device.id }}"
                          }
                        }
                      ]
                    },
                    "children": [
                      {
                        "id": "deviceName",
                        "type": "Text",
                        "props": {
                          "text": "{{ device.name }}"
                        }
                      },
                      {
                        "id": "deviceStatus",
                        "type": "StatusBadge",
                        "props": {
                          "status": "{{ device.status }}"
                        }
                      }
                    ]
                  }
                ]
              }
            ]
          },
          {
            "id": "metricSection",
            "type": "Box",
            "style": {
              "display": "flex",
              "gap": 12
            },
            "children": [
              {
                "id": "temperatureCard",
                "type": "MetricCard",
                "props": {
                  "value": "{{ Math.max(...data.devices.map(d => data.metrics.filter(m => m.deviceId === d.id).at(-1)?.temperature ?? 0)) }}",
                  "label": "最高温度",
                  "unit": "℃"
                }
              },
              {
                "id": "cpuCard",
                "type": "MetricCard",
                "props": {
                  "value": "{{ Math.max(...data.devices.map(d => data.metrics.filter(m => m.deviceId === d.id).at(-1)?.cpu ?? 0)) }}",
                  "label": "最大 CPU 使用率",
                  "unit": "%"
                }
              },
              {
                "id": "trafficCard",
                "type": "MetricCard",
                "props": {
                  "value": "{{ Math.round(data.devices.reduce((sum, d) => sum + (data.metrics.filter(m => m.deviceId === d.id).at(-1)?.trafficMbps ?? 0), 0)) }}",
                  "label": "通信量（合計）",
                  "unit": "Mbps"
                }
              }
            ]
          },
          {
            "id": "alarmSection",
            "type": "Box",
            "style": {
              "display": "flex",
              "flexDirection": "column",
              "gap": 8
            },
            "children": [
              {
                "id": "alarmTitle",
                "type": "Text",
                "props": {
                  "text": "最新アラーム",
                  "variant": "caption"
                }
              },
              {
                "id": "alarmRow",
                "type": "AlarmRow",
                "props": {
                  "alarm": "{{ alarm }}",
                  "deviceName": "{{ data.devices.find(d => d.id === alarm.deviceId)?.name ?? alarm.deviceId }}"
                },
                "repeat": {
                  "each": "{{ data.alarms.toSorted((a, b) => b.occurredAt.localeCompare(a.occurredAt)).slice(0, 5) }}",
                  "as": "alarm",
                  "key": "{{ alarm.id }}"
                },
                "events": {
                  "click": [
                    {
                      "type": "openDialog",
                      "dialog": "alarmDetail",
                      "params": {
                        "alarmId": "{{ alarm.id }}"
                      }
                    }
                  ]
                }
              }
            ]
          }
        ]
      }
    },
    {
      "id": "devices",
      "name": "機器一覧",
      "path": "/devices",
      "root": {
        "id": "page",
        "type": "Box",
        "style": {
          "display": "flex",
          "flexDirection": "column",
          "gap": 16,
          "padding": 24
        },
        "children": [
          {
            "id": "header",
            "type": "Box",
            "style": {
              "alignItems": "center",
              "display": "flex",
              "justifyContent": "space-between"
            },
            "children": [
              {
                "id": "title",
                "type": "Text",
                "props": {
                  "text": "機器一覧",
                  "variant": "title"
                }
              },
              {
                "id": "toDashboard",
                "type": "Button",
                "props": {
                  "label": "ダッシュボードへ",
                  "variant": "secondary"
                },
                "events": {
                  "click": [
                    {
                      "type": "navigate",
                      "to": "dashboard"
                    }
                  ]
                }
              }
            ]
          },
          {
            "id": "deviceTable",
            "type": "Table",
            "props": {
              "columns": [
                {
                  "value": "{{ row.name }}",
                  "header": "名前"
                },
                {
                  "value": "{{ row.model }}",
                  "header": "型番"
                },
                {
                  "value": "{{ ({ online: 'オンライン', offline: 'オフライン', warning: '警告' })[row.status] }}",
                  "header": "ステータス"
                },
                {
                  "value": "{{ row.ipAddress }}",
                  "header": "IP アドレス"
                },
                {
                  "value": "{{ row.firmware }}",
                  "header": "ファームウェア"
                }
              ],
              "rows": "{{ data.devices }}"
            },
            "events": {
              "rowClick": [
                {
                  "type": "navigate",
                  "to": "deviceSettings",
                  "params": {
                    "deviceId": "{{ event.row.id }}"
                  }
                }
              ]
            }
          }
        ]
      }
    },
    {
      "id": "deviceSettings",
      "name": "機器設定",
      "path": "/devices/:deviceId",
      "params": {
        "deviceId": {